{
  "authorization_id": "22222222-2222-4222-8222-222222222222",
  "project_key": "11111111-1111-4111-8111-111111111111",
  "scope_token": "synthetic.hmi.catalog",
  "device_path": [
    "SyntheticDevice",
    "SyntheticRuntime"
  ],
  "module_name": "T05RecipeCatalog",
  "tia_build": "19.0.synthetic",
  "worker_build": "1.0+0000000000000000000000000000000000000000000000000000000000000000",
  "not_before_utc": "2000-01-01T00:00:00Z",
  "expires_utc": "2000-01-01T00:05:00Z",
  "expected_functions": [
    "createCatalog",
    "createRecipeTableModel",
    "directoryFailure",
    "getT05CatalogSchema",
    "HandleRecipeCatalog",
    "performCatalogAction",
    "render",
    "validateData",
    "validateDictionaries"
  ]
}
